,Domain,area,keywords,Abstract
660,Civil , Stealth Technology  , Thermal infrared; low emissivity; chemical deposition; stealth technology        ,"A low-emissive pigment of Al/SiO2/Fe2O3/FeO/Fe-4[Fe(CN)(6)](3)/Cr2O3/Cr (MAS) was prepared by chemical deposition method. The camouflage characteristics of the coated fabric with paint mixed with MAS, binder and other auxiliary in the thermal infrared (IR 8 similar to 14 mu m) and the optical (0.38 similar to 1.2 mu m) region, was studied by emissivity tester, visible light camera and thermal infrared imager. The results show that the MAS pigment has low emissivity and optical camouflage effectiveness compared with the Al/SiO2 pigment. Particularly, the MAS pigment is in green by depositing metal oxide, ferrocyanide and pure metal on the surface of Al/SiO2. The optical reflectance spectrum of coated fabric was similar to the natural grass. Furthermore, the surface emissivity of the coated fabric reached 0.51 in the IR region. The thermography of the coated fabric with 4 wt% MAS was similar to the natural grass. It can conclude that the coated fabric can perfectly imitate grass background."
2,Civil , Green Building  , LED lighting system; PV system; Distributed lighting control; Energy efficiency; Green building; Daylight responsive dimming system        ,"(D)ecreasing of energy consumption and environmentally friendly energy resources are the issues in the foreground nowadays. As the electric energy consumed for the illumination is high, long-lasting and low-consumption LED (light-emitting diode) technology gets prominent. There have been made much reseacrh regarding the use of photovoltaic sytems in meeting the energy demand in housing and industry. However, there is need for more research with regards to photovoltaic sytems' integration with energy efficiency sytems. In this study, for the environments which have different lighting levels due to daylight factor, there has been proposed a low-cost PV (photovoltaics) based and distributed sensor smart LED illuminating system and there has been acquired 72.075% more energy saving in comparison with conventional LED illuminating system. (C) 2017 Elsevier Inc. All rights reserved."
40,Civil , Green Building  , social innovation; schools of sustainability; Jevons Paradox; occupant behavior; ecological thinking in architecture        ,"1. INTRODUCTION Sustainability has been defined as the need to preserve existing natural resources so that the earth is able to continue to provide these resources for future generations. Put more simply, a sustainable system is one that survives or persists (Costanza and Patten, 1995). In order to ensure the sustainability of architectural and building activity, it is essential that work in this field is conducted in accordance with the canons of basic ecology and, in addition, that its members seek to address certain cultural and relational characteristics that typify the way we live today. Architecture as a discipline combines technology and art; however, with the advent of ""sustainable architecture"" additional concepts from the fields of ecology, sociology, and philosophy have been incorporated. Yet, the fundamental problem is that the meanings of both the classical and the new concepts remain ambiguous, their significance shifting with our cultural evolution. Hence, the traditional Vitruvian values of architecture (beauty, structure and utility) are no longer so obvious, especially when we are required to think in terms of sustainability. Although the question as to why architecture matters has been answered in a variety of ways (Glaeser, 2011), it is our contention that in the 21st century architecture will matter more than ever, because by 2050 most of the world's population will be concentrated in cities. As a result, the sustainability of dwellings and cities has acquired undeniable importance. Two interacting forces influence all populations. One is the Malthusian dynamic of exponential growth until environmental limits are reached (Figure 1). The second is the Darwinian dynamics of innovation and adaptation that circumvent these limits through biological or cultural evolution. Nekola et al., in 2013 reported that the specific manifestation of these two forces in our current society provide the context that establishes how humans may develop sustainable relationships within our finite planet (Figure 2). Consequently, a permanent and indefinite growth is impossible due to the physical and biological imperatives of our finite world. Biologists and architects and constructors usually inhabit different worlds. The latter innovate, deploy, and apply their techno-science based designs; the first, study the finite nature, propose hypotheses, and gather their evidence. And, to date, there is little to suggest that copying nature purports any advantages to architects, primarily because fully autonomous buildings or towns have yet to be built. According to the described Malthusian-Darwinian dynamic, the two critical questions that we seek to address in this paper are: i) What is the essence of a sustainable dwelling? and ii) What principles should be adhered to in making a dwelling sustainable? In other words, this study aims to elucidate the essence of sustainability in green building design implementation."
41,Civil , Green Building  , Sustainability; Energy Conservation; Passive Design; Building Use; Climate Zones        ,"1. INTRODUCTION The emergence of environmental problems as major social issues throughout the world has prompted sustainable development efforts in a wide range of areas, including industry, construction, and transportation, followed by the execution of numerous studies and policies. The concept of sustainable development has been dealt with in earnest in the construction field since the Declaration of Interdependence for a Sustainable Future at the 18th Chicago Convention of UIA in 1993. This Declaration included tasks to be implemented with respect to green buildings, such as the recycling of resources, application of energy-efficient designs, and utilization of natural energy in addition to the application of sustainable designs. As part of green building practices, countries around the world have been implementing various green building certification standards, such as LEED, GBCC, CASBEE, and BREEAM. These certification standards prescribe the criteria relating to the external environment, energy conservation, materials and resources, and the indoor environment, with energy conservation being the top priority for each of these issues. This is due to energy consumption in building operation accounting for more than half of the building life cycle cost. Accordingly, although many studies are undertaken for the purpose of developing the means for conserving energy in relation to green buildings, the majority of these studies are concentrated on the development of technologies for environmental facilities through the application of active designs. study the finite nature, propose hypotheses, and gather their evidence. And, to date, there is little to suggest that copying nature purports any advantages to architects, primarily because fully autonomous buildings or towns have yet to be built. According to the described Malthusian-Darwinian dynamic, the two critical questions that we seek to address in this paper are: i) What is the essence of a sustainable dwelling? and ii) What principles should be adhered to in making a dwelling sustainable? In other words, this study aims to elucidate the essence of sustainability in green building design implementation."
269,Civil , Green Building  , Green building; Full life cycle; Incremental cost        ,"A comprehensive analysis framework of the study of green building incremental cost will be given in this paper, from the perspective of the whole life cycle, we will discuss the concept and characteristics of incremental cost, providing it with overall process, whole stage and a full range of recognition and quantitative based on an overall analysis of its factors, then build a framework for its cost of whole life cycle which will provide important theoretical and practical significance to the study of development of green building."
488,Civil , Green Building  , LEED (TM); Arabian Green Building; Simulation; Solar Thermal Cooling; Energy Performance Assessment        ,A gigantic sustainable tourism project is taking shape in the city of Al Ain by order of the government in Abu Dhabi. The Sheikh Zayed Desert Learning Center SZDLC is the first constructed building of the masterplan and functions as museum and research centre for desert environments and ecological issues. The building-owner set ambitious targets for sustainability and energy efficiency and the SZDLC has been already certified in the US program LEED (TM) (Leadership in Energy and Environmental Design) with the LEED (TM) Platinum Standard. With this paper two parts of the pioneering state-of-the-art architecture and technology of the SZDLC project are presented. Firstly a report on basic results of advanced energy modelling and simulation in the planning phase and for the certification method is given and secondly the authors publish energy performance data of the operating solar heat driven absorption cooling system. (C) 2016 Published by Elsevier Ltd.
190,Civil , Solar Energy  , Bubble pump; Bubble motion; Lattice Boltzmann method; Pipe diameter; Coalescence        ,"A bubble pump is proposed to replace the traditional mechanical solution pump in lithium bromide absorption chillers, for its advantageous feature that can be driven by industrial waste heat or solar energy or other low-grade energy. In two-stage bubble pump driven lithium bromide absorption refrigeration system, flow patterns in lifting pipe have significant effects on the performance of bubble pump. In this paper, the single bubble motion and the double bubbles coalescence in vertical ascending pipe are simulated by an improved free energy model of lattice Boltzmann method, in which the two-phase liquid to gas density ratio is 2778. The details of bubbles coalescence process are studied. Density and velocity of bubbles have been obtained. The computational results show that the initial radius of each bubble has a great influence on the coalescence time. The larger the initial bubble radius, the shorter the coalescence time. The pipe diameter has a little effect on the two bubbles coalescence time while it has a significant effect on the bubble velocity. As the pipe diameter increases, the bubble velocity increases. The obtained results are helpful for studying the transition mechanisms of two-phase flow patterns and useful for improving the bubble pump performance by controlling the flow patterns in lifting pipe. (C) 2016 Elsevier Ltd. All rights reserved."
411,Civil , Solar Energy  , Concentrated solar energy; Energy storage; Thermochemical storage; Cobalt oxide; Redox cycles; Pilot-scale system        ,"A first of its kind pilot-scale redox-based thermochemical storage system has been set up and operated under near-realistic conditions inside a solar power tower plant. The storage unit is made of inert honeycomb supports (cordierite) coated with 88 kg of redox active material (cobalt oxide). An experimental campaign has been carried out consisting of 22 thermochemical charge-discharge cycles. The heat absorbed or released by the chemical reaction became clearly evident through the temperature evolution inside the reactive material. It allows to store or release energy at constant temperature when crossing respectively the reduction/oxidation temperature of the Co3O4/CoO pair. A storage performance factor (P-F) was defined to evaluate how each experiment approaches the ideal behavior. During the complete campaign no measurable cycle-to-cycle degradation was observed and the system average capacity was very close to the ideal case of P-F = 0.84. The advantage of thermochemical storage could be quantified by comparing the storage capacity, to that of a sensible-only storage unit made of uncoated cordierite honeycombs. The thermochemical system offered almost double storage capacity (47.0 kW h) cf. the same volume of the sensible-only case (25.3 kW h). (C) 2016 Elsevier Ltd. All rights reserved."
425,Civil , Solar Energy  , optical communication; solid-state lasers; solar energy        ,"A free-space optical communication system with a sun light directly pumped laser as the signal transmitter was demonstrated. A 0.6 x 0.6 m Fresnel lens was used as the primary concentrator to collect the solar light. 6.8 W continuous wave laser power was obtained from a 4 mm diameter grooved Nd:YAG rod. The output intensity was modulated with a video signal via a LiNbO3 Mach-Zehnder optoelectronic modulator. The video signal with a resolution of 1920 * 1080/frame and the frame rate of 25 Hz was transmitted over five-meter free-space in real time with high fidelity. The transmission rate was 125 Mbps and bit error rate was lower than 10(-6). This research shows the feasibility of applying a solar light directly pumped laser for free-space optical communication, which is significant for telecommunications between satellites."
573,Civil , Solar Energy  , Combined cooling heating and power (CCHP) system; Operating strategy; Hybrid electric-thermal (HET) following method; Natural gas; Solar energy        ,"A hybrid electric-thermal (HET) following method is proposed for a combined cooling, heating and power (CCHP) system driven by natural gas and solar energy, focusing on the supply matching of domestic hot water, space cooling/heating and electricity. The domestic hot water thermal demand (Class A) is set to be met preferentially due to its immediateness and timeliness, and the space cooling/heating (Class B) thermal demand matching condition will be discussed from the view of comfort reliability. Detailed strategy methods under summer and winter conditions are presented. Variable electric-thermal ratio (RA, the ratio of the thermal demand of domestic hot water to the electric demand, RE, the ratio of the thermal demand of space cooling/heating to the electric demand) load conditions are analyzed and a comparison of HET between the base following electric load and following thermal load strategies is discussed for hotel applications. The criteria including primary energy consumption, carbon dioxide emission, operation cost and exergy efficiency is employed to evaluate the performances in the HET strategy. The results indicate that HET can achieve more benefits than the base operation strategies. (C) 2017 Elsevier Ltd. All rights reserved."
575,Civil , Solar Energy  , anodes; microbial fuel cells; photoelectrochemical cells; pollutants; titania        ,"A hybrid photoelectrochemical and microbial fuel cell (HPMFC) is constructed for simultaneous utilization of solar energy and bioenergy by installing a TiO2 photoanode next to a bioanode that shares the same cathode in a microbial fuel cell (MFC). Connecting the photoelectrochemical (PEC) circuit results in enhanced cathode potentials for the MFC based on the differences in power output characteristics of MFC and PEC alone. The improved power production of the MFC is accompanied by a relatively small decline in the power density of the PEC, yielding an overall enhancement in power output for the HPMFC."
103,Civil , Construction Management  , Biophilia; Construction; Ergonomics; Performance; Sustainability; Wellbeing; Labor and personnel issues        ,"85% of a construction worker's work-day is spent on the construction site. This means that a large part of a worker's health and wellbeing could depend on the construction site and its environs. Construction work, which is inherently stressful due to the ever present threat of fatalities and injuries, compromises the ergonomic reality and human sustenance on construction sites. This necessitates the need to create a beneficial and comfortable environment that is motivational, inspirational, and healing. The biophilic construction site model (BCSM) which involves methodology of 'greening construction sites', is proposed as a healthy means of tapping into the natural resources of the construction site environment. It is intended to create a comfort zone on the construction site that would generate a symbiotic benefit to enhance its humanistic value and engender the health and wellbeing and creative performance of workers. The paper reports on a case study in the form of a focus group study and a comparative analysis of two similar construction sites in the Northern Cape region of South Africa. The findings present the healthy inter-nurture existing between a living construction site and its human occupants as a cost effective psychotherapeutic intervention in sustainable sites initiative and ergonomics, which according to research findings is as of yet missing in the construction management body of knowledge (CMBOK). The paper conclusively recommends the 'greening of construction sites'; specifically the inclusion of plants within site offices, welfare facilities and worksite premises; as a relevant means of harnessing nature's healing and rejuvenating essence towards a more productive goal in construction. (C) 2014 American Society of Civil Engineers."
262,Civil , Construction Management  , Project management; Scheduling; Critical path method; Construction costs; Control        ,"A complex construction program usually consists of a group of interrelated projects with different levels of importance and degrees of certainty. Currently, time management of a construction program uses the same techniques as those for a single project, and the most commonly used technique is the critical path method (CPM). However, the CPM method lacks flexibility in handling uncertainties and options, a desirable feature in managing complex programs. This paper proposes a new scheduling method that is drawn from the authors' experiences of managing a large-scale construction program-the Shanghai Expo facility construction. The new method is developed on the basis of the traditional CPM method but is able to incorporate options and importance levels into the program schedule. The theoretical basis and calculation method of this new scheduling technique are discussed in the context of managing the Shanghai Expo facility construction program. This paper contributes to the body of knowledge in construction management by developing a new scheduling technique with proven applications. (C) 2014 American Society of Civil Engineers."
447,Civil , Construction Management  , Construction costs; Estimation; Remote sensing; Construction management; Pricing; Cost and schedule        ,"A fundamental process in construction cost estimation is the appropriate adjustment of costs to reflect project location. Unfortunately, location adjustment factors are not available for all locations. To overcome this lack of data, cost estimators in the United States often use adjustment factors from adjacent locations, referred to as the nearest neighbor (NN) method. However, these adjacent locations may not have similar economic conditions, which limit the accuracy of the NN method. This research proposes a new method of using nighttime light satellite imagery (NLSI) to estimate location adjustment factors where they do not exist. The NLSI method for estimating location adjustment factors was evaluated against an established cost index database, and results show that NLSI can be used to effectively estimate location adjustment factors. When compared with NN and other alternative proximity-based location adjustment methods, the proposed NLSI method leads to a 25-40% reduction of the median absolute error. This work contributes to the body of knowledge by introducing a more accurate method for estimating location adjustment factors which can improve cost estimates for construction projects where location adjustment factors do not currently exist. (C) 2016 American Society of Civil Engineers."
511,Civil , Construction Management  , modern city; Santiago; Karl Brunner; regulatory plan; representation        ,"A group of plans recently found at the Construction Management of the Municipality of Santiago being part of the Official Plan of Urbanization of the Commune of Santiago in scales 1: 5,000 and 7: 7,000 dated in 1939 has enabled to carry out a research that, from representation, studies and analyzes the condition of ""modern city"" for our capital city. The plans were valid for fifty years in the management of the city's urban development. They find their origins in Karl Brunner's studies and proposals between 7929 and 7932 and in the draft project that made them possible during his second stay in 1934, which Robert Humeres finally developed in the five coming years. The problem we approach in this article is, therefore, related to the capacity of this cartography to contain a specific idea of ""modern city"". In fact, the thesis of this article is that the Official Plan gives an account of both, an existing city, rigorously registered, and a new one arising as a product of its transformation according to the indications represented on it. In this double intentionality underlies, from our point of view, a clearly ""modern"" bias, evidenced in both the willingness for understanding the new that comes from the pre-existent phenomenon, as the necessary abstraction its representation should achieve to allow both worlds to cohabitate in the plan. This observation is confirmed when we prove the plan is configured from three types of lines that synthetize the complexity of the public space."
673,Civil , Construction Management  , Occupational safety; Fatalities; Project management; Labor and personnel issues        ,"A major cause of fatal construction accidents is falls from height (FFH). In this study, the Human Factor Analysis and Classification System (HFACS) was adopted and modified to assist in classifying the root causes of fatal FFH accidents in Hong Kong. The characteristics and root causes of the accidents were analyzed using frequency analysis. The associations among the causes were examined using Fisher's exact test and latent class analysis (LCA). The cases apparently share some common characteristics and certain HFACS factors are closely associated. According to LCA results, the factors in all the cases may be placed into four classes, named as ill planning, violation, hidden hazards created by others, and incapable staffing. Recommendations are made to reduce FFH construction accidents based on the characteristics and root causes. The paper contributes to the body of knowledge in construction management by developing a modified HFACS framework for extracting structured information from construction accident reports, finding the general characteristics and managerial causes behind the FFH accidents, and using LCA to identify the connections among the managerial causes."
72,Civil , Smart Material  , Smart explosive; Intermolecular interaction; TNT/CL-20 co-crystal; Structure and properties        ,"2,4,6,8,10,12-hexanitro-2,4,6,8,10,12-hexaazaisowurtzitane (CL-20) is a high-energy nitramine explosive with high mechanical sensitivity. 2,4,6-trinitrotoluene (TNT) is insensitive but by no means a high performance explosive. To reveal the significant importance and smart-material functionality of the energetic-energetic co-crystals, the stability, mechanical and explosive properties TNT/CL-20 co-crystal, TNT crystal and CL-20 crystal were studied. Non-hydrogen bonded non-covalent interactions govern the structures of energetic-energetic co-crystals. However, it is very difficult to accurately calculate the non-covalent intermolecular interaction energies. In this paper, the local conformation and the intricate non-covalent interactions were effectively mapped and analyzed from the electron density (rho) and its derivatives. The results show that the two components TNT and CL-20 are connected mainly by nitro-aromatic interactions, and nitro-nitro interactions. The steric interactions in TNT/CL-20 could not be confronted with the attractive interactions. Moreover, the scatter graph of TNT crystal reveals the reason why TNT is brittle. The detailed electrostatic potential analysis predicted that the detonation velocities (D) and impact sensitivity for the compounds both increase in the sequence of CL-20 >TNT/CL-20 co-crystal >TNT. Additionally, TNT/CL-20 co-crystal has better malleability than its pure components. This demonstrates the capacity and the feasibility of realizing explosive smart materials by co-crystallization, even if strong hydrogen bonding schemes are generally lacking in energetic materials."
