,Domain,area,keywords,Abstract
5,CS , Computer vision  , Tea category identification; computer vision; color histogram; wavelet packet entropy; winner-takes-all; radial basis function; artificial neural network; pattern recognition; support vector machine        ,"(Objective) In order to increase classification accuracy of tea-category identification (TCI) system, this paper proposed a novel approach. (Method) The proposed methods first extracted 64 color histogram to obtain color information, and 16 wavelet packet entropy to obtain the texture information. With the aim of reducing the 80 features, principal component analysis was harnessed. The reduced features were used as input to generalized eigenvalue proximal support vector machine (GEPSVM). Winner-takes-all (WTA) was used to handle the multiclass problem. Two kernels were tested, linear kernel and Radial basis function (RBF) kernel. Ten repetitions of 10-fold stratified cross validation technique were used to estimate the out-of-sample errors. We named our method as GEPSVM + RBF + WTA and GEPSVM + WTA. (Result) The results showed that PCA reduced the 80 features to merely five with explaining 99.90% of total variance. The recall rate of GEPSVM + RBF + WTA achieved the highest overall recall rate of 97.9%. (Conclusion) This was higher than the result of GEPSVM + WTA and other five state-of-the-art algorithms: back propagation neural network, RBF support vector machine, genetic neural-network, linear discriminant analysis, and fitness-scaling chaotic artificial bee colony artificial neural network."
81,CS , Computer vision  , Human pose estimation; 3D Shape recovery; 3D Human pose estimation; 3D Reconstruction        ,"3D human pose estimation from a single image is an important problem in computer vision with a number of applications, including action recognition and scene understanding. However, it is still challenging due to its ill-posedness and complex non-rigid shape variations of a human body. In this paper, we use the Procrustean normal distribution mixture model as a 3D shape prior and propose a model transformation method for adjusting limb lengths of the 3D shape prior model, by which the proposed method can be applied to a novel test image. Inaccuracies of 2D part detections are handled by selecting from a diverse set of 2D pose candidates considering both the 2D part model and 3D shape model. Experimental results show that the proposed method performs favorably compared with existing methods, despite inaccuracies of 2D part detections and 3D shape ambiguities. (C) 2016 Elsevier Inc. All rights reserved."
274,CS , Computer vision  , imaging; radiometric calibration; Raspberry Pi camera        ,"A comprehensive radiometric characterization of raw-data format imagery acquired with the Raspberry Pi 3 and V2.1 camera module is presented. The Raspberry Pi is a high-performance single-board computer designed to educate and solve real-world problems. This small computer supports a camera module that uses a Sony IMX219 8 megapixel CMOS sensor. This paper shows that scientific and engineering-grade imagery can be produced with the Raspberry Pi 3 and its V2.1 camera module. Raw imagery is shown to be linear with exposure and gain (ISO), which is essential for scientific and engineering applications. Dark frame, noise, and exposure stability assessments along with flat fielding results, spectral response measurements, and absolute radiometric calibration results are described. This low-cost imaging sensor, when calibrated to produce scientific quality data, can be used in computer vision, biophotonics, remote sensing, astronomy, high dynamic range imaging, and security applications, to name a few. (C) The Authors. Published by SPIE under a Creative Commons Attribution 3.0 Unported License. Distribution or reproduction of this work in whole or in part requires full attribution of the original publication, including its"
281,CS , Computer vision  , Autonomous fire suppression; Fire detection; Suppression systems; IR stereovision; Robotics        ,"A computer vision-based autonomous fire suppression system with real-time feedback of fire size and spray direction is presented in this paper. The system has been developed for use in a firefighting robot for close-range, localized fire suppression tasks in enclosed environments. A probabilistic water classification method was developed for segmenting water spray in a pair of IR cameras. Stereo processing was performed to localize points along the spray path for use in yaw and pitch angle estimation. A Golden Section Search with linear least squares optimization was used to determine the optimal pitch angle of the spray position at each sampling time. Kalman filtering was used to remove noise from the angle measurements and obtain a better estimate of the current nozzle orientation. A decision tree was used to determine the correct nozzle positioning mode using image feedback to suppress the fire and accounts for errors in direction, fire size during suppression, and when to adjust the nozzle based on IR feedback. Through implementation of a PI controller, the system is able to correct for unknown disturbances causing erroneous targeting of a localized fire. Experiments are presented with the initial nozzle angled correctly and with forced offsets in the system to set the initial spray position incorrectly in order for the system to correct. Suppression times ranged from 7.2 s to 16.3 s with a standard deviation of 3.9 s and average time of 11.2 s. A total of 12 tests demonstrated performance of the system given a forced offset to the initial nozzle orientation resulting in an error between the spray location and the fire target. Suppression times ranged from 8.1 s to 27.9 s with a mean of 16.9 s and standard deviation of 6.2 s. The proposed system can be implemented on a robotic firefighting platform to autonomously detect a fire, choose a proper manipulation goal and suppress full scale fires given disturbances causing erroneous targeting."
329,CS , Computer vision  , Motion magnification; Phase-based optical flow; Video; Computer vision; Non-contact measurement; System identification; Unscented Kalman filters        ,"A damage detection methodology is proposed by integrating a nonlinear recursive filter and a non-contact computer vision based algorithm to measure structural dynamic responses. A phase-based optical flow algorithm inspired by the motion magnification technique is used to measure structural displacements, and the unscented Kalman filter is used to predict structural properties such as stiffness and damping coefficients. This non-contact displacement measurement methodology does not require an intensive instrumentation process, does not add any additional mass to the structure which may skew measurements, and can measure more signals compared to traditional methods. This measurement methodology still needs improvement as a tool due to its higher noise level relative to traditional accelerometer and laser vibrometer measurements. In order to detect structural damage using measured displacements from video, an unscented Kalman filter is used to remove noise from the displacement measurement and simultaneously detect damage by identifying the current stiffness and damping coefficient values, given a known mass, which are used to detect damage. To validate the proposed damage detection method state-space equations are derived without external excitation input and experimental tests are carried out. The experimental results show reasonable and accurate predictions of the stiffness and damping properties compared to dynamic analysis calculations. (C) 2016 Elsevier Ltd. All rights reserved."
50,CS , Machine learning  , distribution; endangered species; groundwater; invertebrates; stream; urban development        ,"1. Species distribution modelling can be useful for the conservation of rare and endangered species. Freshwater mussel declines have thinned species ranges producing spatially fragmented distributions across large areas. Spatial fragmentation in combination with a complex life history and heterogeneous environment makes predictive modelling difficult. 2. A machine learning approach (maximum entropy) was used to model occurrences and suitable habitat for the federally endangered dwarf wedgemussel, Alasmidonta heterodon, in Maryland's Coastal Plain catchments. Landscape- scale predictors (e. g. land cover, land use, soil characteristics, geology, flow characteristics, and climate) were used to predict the suitability of individual stream segments for A. heterodon. 3. The best model contained variables at three scales: minimum elevation (segment scale), percentage Tertiary deposits, low intensity development, and woody wetlands (sub- catchment), and percentage low intensity development, pasture/ hay agriculture, and average depth to the water table (catchment). Despite a very small sample size owing to the rarity of A. heterodon, cross- validated prediction accuracy was 91%. 4. Most predicted suitable segments occur in catchments not known to contain A. heterodon, which provides opportunities for new discoveries or population restoration. These model predictions can guide surveys toward the streams with the best chance of containing the species or, alternatively, away from those streams with little chance of containing A. heterodon. 5. Developed reaches had low predicted suitability for A. heterodon in the Coastal Plain. Urban and exurban sprawl continues to modify stream ecosystems in the region, underscoring the need to preserve existing populations and to discover and protect new populations. Copyright # 2016 John Wiley & Sons, Ltd."
136,CS , Machine learning  , 3-D network-on-chip (NoC); discrete optimization; machine-learning; small-world (SW)        ,"A 3-D network-on-chip (NoC) enables the design of high performance and low power many-core chips. Existing 3-D NoCs are inadequate for meeting the ever-increasing performance requirements of many-core processors since they are simple extensions of regular 2-D architectures and they do not fully exploit the advantages provided by 3-D integration. Moreover, the anticipated performance gain of a 3-D NoC-enabled many-core chip may be compromised due to the potential failures of through-silicon-vias that are predominantly used as vertical interconnects in a 3-D IC. To address these problems, we propose a machine-learning-inspired predictive design methodology for energy-efficient and reliable many-core architectures enabled by 3-D integration. We demonstrate that a small-world network-based 3-D NoC (3-D SWNoC) performs significantly better than its 3-D MESH-based counterparts. On average, the 3-D SWNoC shows 35% energy-delay-product improvement over 3-D MESH for the PARSEC and SPLASH2 benchmarks considered in this paper. To improve the reliability of 3-D NoC, we propose a computationally efficient spare-vertical link (sVL) allocation algorithm based on a state-space search formulation. Our results show that the proposed sVL allocation algorithm can significantly improve the reliability as well as the lifetime of 3-D SWNoC."
206,CS , Machine learning  , High dimensionality classification; Distance function; Fractional distance; Local Partial Least Squares        ,"A central idea in distance-based machine learning algorithms such k-nearest neighbors and manifold learning is to choose a set of references, or a neighborhood, based on a distance functions to represent the local structure around a query point and use the local structures as the basis to construct models. Local Partial Least Square (local PLS), which is the result of applying this neighborhood based idea in Partial Least Square (PLS), has been shown to perform very well on the regression of small-sample sized and multicollinearity data, but seldom used in high-dimensionality classification. Furthermore the difference between PLS and local PLS with respect to their optimal intrinsic dimensions is unclear. In this paper we combine local PLS with non-Euclidean distance in order to find out which measures are better suited for high dimensionality classification. Experimental results obtained on 8 UCI and spectroscopy datasets show that the Euclidean distance is not a good distance fiinction for use in local PLS classification, especially in high dimensionality cases; instead Manhattan distance and fractional distance are preferred. Experimental results further show that the optimal intrinsic dimension of local PLS is smaller than that of the standard PLS."
264,CS , Machine learning  , Machine learning; Prediction explanation; Intelligent system; Black-box models; B2B Sales forecasting        ,"A complexity of business dynamics often forces decision-makers to make decisions based on subjective mental models, reflecting their experience. However, research has shown that companies perform better when they apply data-driven decision-making. This creates an incentive to introduce intelligent, data based decision models, which are comprehensive and support the interactive evaluation of decision options necessary for the business environment. Recently, a new general explanation methodology has been proposed, which supports the explanation of state-of-the-art black-box prediction models. Uniform explanations are generated on the level of model/individual instance and support what-if analysis. We present a novel use of this methodology inside an intelligent system in a real-world case of business-to-business (B2B) sales forecasting, a complex task frequently done judgmentally. Users can validate their assumptions with the presented explanations and test their hypotheses using the presented what-if parallel graph representation. The results demonstrate effectiveness and usability of the methodology. A significant advantage of the presented method is the possibility to evaluate seller's actions and to outline general recommendations in sales strategy. This flexibility of the approach and easy-to-follow explanations are suitable for many different applications. Our well-documented real-world case shows how to solve a decision support problem, namely that the best performing black-box models are inaccessible to human interaction and analysis. This could extend the use of the intelligent systems to areas where they were so far neglected due to their insistence on comprehensible models. A separation of the machine learning model selection from model explanation is another significant benefit for expert and intelligent systems. Explanations unconnected to a particular prediction model positively influence acceptance of new and complex models in the business environment through their easy assessment and switching. (C) 2016 Elsevier Ltd. All rights reserved."
306,CS , Machine learning  , Machine learning; Validity index; Cross validation; Dimensionality reduction algorithm        ,"A critical aspect of dimensionality reduction is to assess the quality of selected (or produced) feature subsets properly. Feature subset assessment in machine learning refers to split a given feature subset into a training set, which is used to estimate the parameters of a classification model, and a test set used to estimate the predictive performance of the model. Then, averaging the results of multiple splitting (i.e., Cross-Validation, CV) is commonly used to decrease the variance of the estimator. But in practice, CV scheme is very computationally expensive. In this paper, we propose a new statistics index method called LW-index for evaluation of feature subset and dimensionality reduction algorithms in general. The proposed method is a type of ""classical statistics"" approach that uses the feature subset to compute an empirical estimate of the quality of feature subset. A large number of performance comparisons with the machine learning approach conducted on fourteen benchmark collections show that the proposed LW index is highly correlated with the external indices (i.e., MacroF(1), MicroF(1)) of SVM and Centroid-Based Classifier (CBC) trained by five-fold CV scheme. Furthermore, the experimental results indicate that LW index has the same performance as the traditional CV scheme for evaluating the dimensionality reduction algorithms and it is more efficient than the traditional methodology. Therefore, one contribution of this paper is to present an alternative methodology, based on an internal index typically used in the unsupervised learning context, that is computationally cheaper than the traditional CV methodology. Another contribution is to propose a new internal index that behaves better than other similar indices widely used in clustering and shows high correlation with the results obtained by the traditional methodology. (C) 2017 The Authors. Published by Elsevier B.V."
73,CS , network security  , bitcoin; mining; cost of transaction        ,"2008 is the year of creation of the Bitcoin network consisting of a decentralized database, which is storing all transactions of bitcoin tokens, whose quantity is predetermined by a protocol and independent of any authority. The aim of this article is to describe the limits in the use of Bitcoin as medium of exchange. Bitcoin network operation is carried out at high costs of electrical energy consumption, which, will over time be reflected in the price of transactions. Low transaction prices, which is one of the main arguments of Bitcoin promoters, are only possible with continuous issuance of new bitcoins to circulation. Bitcoin's - ""prove of work"" - is the most energetically demanding method from all currently existing methods securing cryptoplatforms. Halving mechanism which reduces the rewards of miners create pressure to decrease hash rate, which is a reflection of the rate of network security. The pressure to decrease hash rate is for now overrun by the increasing efficiency of mining devices. The future will therefore probably bring us fundamental questions: What will it mean for Bitcoin network, if the real costs of running the network will be reflected in costs of transaction? How will Bitcoin network be able to compete with other cryptocurrencies, whose operation is carried out at a much lower cost? Will halving mechanism ultimately cause a declined hash rate, and thereby also a reduction in network security?"
98,CS , network security  , 5G; network security; digital signature; proxy signature; chameleon hash        ,"5G mobile networks are promising to offer mobile users unrivaled experiences with infinite networking capability at any period and from anywhere. However, it appears unnecessary and impractical for the customers and servers to be connected permanently in wireless networks because battery life is a bottleneck in such kind of networks. Therefore, the authorized entity needs to delegate its right to others in order to ensure the services available. This paper aims to address the issue of delegating authentication in 5G networks by proposing a new proxy signature scheme with efficient proxy signing operations. Concretely, we present a new and efficient proxy signature algorithm whose unforgeability can be reduced to the well-known discrete logarithm assumption. In the proposal, the original signer delegates his signing right by signing an exposure-free chameleon hash value on the warrant, and the proxy signer can generate a proxy signature on a message only by calculating a chameleon hash collision between the warrant and the message. This approach is computationally cost-effective for the proxy signer. Further analysis of the new scheme demonstrates that it offers the desirable properties of delegation of signing sights. Copyright (c) 2015 John Wiley & Sons, Ltd."
331,CS , network security  , darknet monitoring system; Internet threat monitoring; localization attack; packet sampling; network security        ,"A darknet monitoring system is developed to grasp malicious activities on the Internet in an early stage and to cope with them. The darknet monitoring system consists of network sensors deployed widely on the Internet. The sensors capture incoming unsolicited packets. A goal of this system analyzes captured malicious packets and provides effective information for protecting good Internet users from malicious activities. To provide effective and reliable information, sensors must be deployed in secret and hidden from outside. On the other hand, attackers intend to detect sensors for evading them. This attempt is known as localization attacks to darknet monitoring systems. If actual location of sensors is revealed to attackers, it is almost impossible to grasp the latest tactics used by attackers. Thus in our previous work, we proposed a packet sampling method, which samples incoming packets based on an attribute of packets sender, to increase a tolerance to a localization attack and to keep a high quality of information publicized by the system. As a result, we almost succeeded to counter from a localization attack, which generates spike on the publicized graph to detect a sensor. However in some cases, proposed sampling method works to attacker's advantage and spikes appear clearly on the graph. Therefore, we propose advanced sampling methods, which sample incoming packets based on multiple attributes of packets sender. In this paper, we present our improved methods and show a promising evaluation result obtained from the simulation."
372,CS , network security  , Network security; DDoS attacks; Flash events; Entropy; Information distance        ,"A Distributed Denial of Service (DDoS) attack is an austere menace to extensively used Internet-based services. The in-time detection of DDoS attacks poses a tough challenge to network security. Revealing a low-rate DDoS (LR-DDoS) attack is comparatively more difficult in modern high speed networks, since it can easily conceal itself due to its similarity with legitimate traffic, and so eluding current anomaly based detection methods. This paper investigates the aptness and impetus of the information theory-based generalized entropy (GE) and generalized information distance (GID) metrics in detecting different types of DDoS attacks. The results of GE and GID metrics are compared with Shannon entropy and other popular information divergence measures. In addition, the feasibility of using these metrics in discriminating a high-rate DDoS (HR-DDoS) attack from a similar looking legitimate flash event (FE) is also verified. We used real and synthetically generated datasets to elucidate the efficiency and effectiveness of the proposed detection scheme in detecting different types of DDoS attacks and FEs. The results clearly show that the GE and GID metrics perform well in comparison with other metrics and have reduced false positive rate (FPR). (C) 2017 Elsevier B.V. All rights reserved."
586,CS , network security  , Smart Grid; Network Assessment; Planning; Security; Network Performance        ,"A key aspect of realizing the future smart grid communication solution is a balanced approach between the network performance and the network security during the network deployment. A high security communication flow path is not useful when the network path cannot support capacity and reachability requirements. The deployment phase in communication network can facilitate an optimal network path by focusing on both the network performance and the network security at the same time. In this paper, we describe a use case of smart grid application where security, network capacity and reachability needs to be optimal for successful network operation. We explain our proposed balancing approach of the network performance and the network security which can be useful for the optimal smart grid secure system design."
529,CS , Cryptography  , Handover authentication; Elliptic curve cryptography; Impersonation attack; Random oracle model; ProVerif        ,"A handover authentication protocol ensures secure and seamless roaming over multiple access points. A number of such protocols are proposed, but most of these protocols are inefficient or insecure. Very recently, Li et al. (Wireless Pers Commun 80(2):581-589, 2015) proposed a privacy-aware handover authentication protocol, and claimed their protocol to be more lightweight and secure than existing protocols. However, our analysis identifies that Li et al.'s protocol is insecure against access point impersonation attack. As a remedy, we proposed an improved protocol to fix the security weakness of Li et al.'s protocol. The improved protocol achieves the provable security in the random oracle model against the hardness assumptions of the elliptic curve discrete logarithm problem and elliptic curve computational Diffie-Hellman problem. The proposed handover authentication protocol is also formally analyzed with the automated tool ProVerif. The improved protocol not only enhances the security but is more lightweight than other related protocols."
