,Domain,area,keywords,Abstract
291,Psychology  , Leadership  , complexity; hierarchical process modelling; leadership; leadership decision-making; management; wider outcomes        ,"A continuing challenge for the education system is how to evaluate the wider outcomes of schools. Wider measures of success - such as citizenship or lifelong learning - influence each other and emerge over time from complex interactions between students, teachers and leaders, and the wider community. Unless methods are found to evaluate these broader outcomes, which are able to do justice to learning and achievement as emergent properties of the learner's engagement with his or her world the education system will continue to focus on narrow measures of school effectiveness which do not properly account for complexity. In this article we describe the rationale and methodology underpinning a pilot research project that applied hierarchical process modelling to a group of schools as complex living systems, using software developed by engineers at the University of Bristol, called Perimeta. The aim was to generate a stakeholder owned systems design which was better able to account for the full range of outcomes valued by each school, and for the complex processes which facilitate or inhibit them, thus providing a more nuanced leadership decision-making analytic. The project involved three academies in the UK."
1606,Psychology  , Leadership  , executive succession; board of directors; upper echelons        ,"A wealth of governance research has examined CEO successions and the negative organizational consequences that arise when boards are unable to effect smooth leadership transitions. Despite those findings, empirical and anecdotal evidence indicates that disruptive successions are still very common. In this article, we investigate whether disruptive CEO successions are viewed as a governance lapse by the board. We focus specifically on succession processes that involve the use of an interim leader. We leverage established research that shows that the pattern of board turnover observed in the wake of negative events is indicative of whether board behaviors are-in practice-viewed as normative violations. We theorize that audiences will disapprove of boards' use of interim CEOs and, therefore, expect that these successions will prompt higher rates of board turnover than those observed following noninterim successions. However, we also anticipate that this relationship will be moderated by situational characteristics (e.g., surprise CEO departure, dynamic industry environment) that complicate succession planning and make audiences more accepting of a board's decision to rely on an interim CEO. Our analysis of 438 successions at publicly traded U.S. firms provides support for these arguments. We discuss the implications of our findings for successions and corporate governance."
2125,Psychology  , Leadership  , Quench protection; accelerator dipoles; superconducting magnets        ,"After Large Hadron Collider will be turned OFF, a new, more energetic machine will be needed in order to explore unknown regions of the high-energy physics. For this reason, the project Future Circular Collider (FCC) has started, with the goal of developing a 100-km-circumference collider of 50 TeV proton beams. The Eurocircol collaboration is part of the FCCstudy under the European Community leadership, and it aims to develop a conceptual design of FCC till 2019. One of the main targets is to design a bending dipole able to reach 16 T operation magnetic field, in order to accomplish the size and energy constraints. Such a magnetic field can be reached using Nb3Sn conductors. One option under exploration is the Cos. dipole, by INFN of Milano and Genova. Because of the high stored energy and the large current densities due to the conductor performances, quench protection is one of the most challenging aspects of the design. In this paper, the quench protection of the cos. design is presented. A standard quench protection study is accompanied by a less conservative study which includes ac effects on the power dissipation inside the coils and on the magnet inductance, in order to not exclude preventively more convenient designs, and to develop a more performing magnet as possible."
2408,Psychology  , Leadership  , Death; physician aid-in-dying; Mori; New Zealand; elders        ,"Aim: To explore kaumtua attitudes towards physician aid-in dying, to gain a clear understanding of how such attitudes may influence and shape their expectations of medical care at the end of life and to assist health professionals in Aotearoa/New Zealand to address the healthcare needs of older Mori near the end of life. Design: A kaupapa Mori consistent approach was undertaken. A systematic narrative technique was employed for the qualitative data analysis. Data were triangulated through independent data coding by three researchers (two of whom identified as Mori researchers), to ensure a robust and consistent method of analysis as well as adhering to a kaupapa Mori research approach. Setting/participants: Recruitment of participants was through kaumtua of Te Kupenga Hauora Mori (Mori leadership within the Faculty of Medical and Health Sciences), University of Auckland and local Auckland marae. Focus group or individual interviews (as per their preference) were undertaken with 20 Kaumtua from the Auckland region. Results: Five closely interrelated themes were identified from kaumtua narratives regarding physician aid-in dying. These were (1) attitudes and understandings of physician aid-in dying, (2) influence of power, (3) significance of kawa, (4) whnau relationships and the (5) significance of wairua. Conclusion: The study demonstrated that for these kaumtua, medical practices that hasten death such as physician aid-in dying are not all just about the dying'. Tikanga and kawa are important processes and concepts to understand during death and dying, and whnau are central to such processes being respected by those involved in the dying process. These factors are so closely intertwined that they cannot be considered in separation of each other."
2459,Psychology  , Leadership  , behavioural research; food service; malnutrition; qualitative research; workforce        ,"AimImplementation of an intervention can result in a discrepancy between what was planned and what is delivered, affecting outcomes for recipients. The aim was to explore, from the perspective of hospital foodservice staff, their experiences delivering a nutrition intervention and the barriers and enablers to its implementation. MethodsA process evaluation of a pilot study was undertaken using qualitative description. A purposive sample (n = 15) of hospital foodservice supervisors and foodservice assistants responsible for delivering a higher energy menu to hospital patients participated in focus groups and semistructured interviews. Theoretical frameworks of behaviour underpinned the method. Content analysis elicited factors (sub-themes) influencing foodservice staff's capability, opportunity and motivation to provide the nutrition intervention. Thematic analysis (by two independent researchers) further explored factors (themes) related to the process of the intervention's implementation. ResultsFive key themes (and 15 sub-themes) explained factors effecting implementation of the nutrition intervention. Aspects of the foodservice environment and patients' resistance were barriers to implementation and perceived sustainability. Teamwork, problem solving, leadership and job satisfaction were enablers. There was an opportunity to optimise training and feedback. Characteristics of foodservice staff, including their: knowledge, beliefs and perceptions of diet, health and their job role, had the potential to influence their behaviours and decision making. ConclusionsA number of interacting factors influenced foodservice staff's delivery of a higher energy menu as planned. Addressing the challenges of time, foodservice structure, patients' resistance, gaps in knowledge and misconceptions among foodservice staff may enhance similar nutrition interventions in the future."
118,Psychology  , Eating disorders  , intracranial germinoma; atypical major depressive episode; binge eating behavior; body weight gain        ,"A 17-year-old adolescent boy presented with atypical major depressive episode (MDE) without specific focal neurological signs for 6 months. He had a diagnosis of intracranial germinoma, and the atypical MDE symptoms subsided after the operation. However, he had a relapse of atypical MDE 7 months after the first surgery. His mood and binge eating symptoms subsided, but intractable body weight gain only partially improved after treatment. When encountering manifestations of depression with atypical features, especially with binge eating symptoms in male children and adolescents, with early onset age, no family history, and prolonged depressive episodes, clinicians should consider not only mood disorders including bipolar spectrum disorders but also organic brain lesions such as intracranial germinoma."
182,Psychology  , Eating disorders  , Severe and enduring anorexia nervosa; SE-AN; Narrative inquiry; Metaphor        ,"A bold step forward in our approach to Severe and Enduring Anorexia Nervosa invites new paradigms for research and practice. It provides an opportunity for us to explore fault lines, both in our communities of practice and the social structures that inform them. This paper serves to question the medical metaphors on which treatment has been based, in favour of alternative perspectives that resonate more clearly with the lived experience of those for whom it has failed. We invite the consideration of alternative metaphors, which can disrupt the notion of heroic patients (and therapists), mediate against acts of self-silencing and sensitising us to more radical acts of listening. Beyond the randomised trials and manuals it is time for us to listen to the realities of suffering, the minutiae of resistance and the life that can still be lived."
603,Psychology  , Eating disorders  , Body image; Celebrity; Peer; Instagram; Media; Social comparison        ,"A large body of research has documented that exposure to images of thin fashion models contributes to women's body dissatisfaction. The present study aimed to experimentally investigate the impact of attractive celebrity and peer images on women's body image. Participants were 138 female undergraduate students who were randomly assigned to view either a set of celebrity images, a set of equally attractive unknown peer images, or a control set of travel images. All images were sourced from public Instagram profiles. Results showed that exposure to celebrity and peer images increased negative mood and body dissatisfaction relative to travel images, with no significant difference between celebrity and peer images. This effect was mediated by state appearance comparison. In addition, celebrity worship moderated an increased effect of celebrity images on body dissatisfaction. It was concluded that exposure to attractive celebrity and peer images can be detrimental to women's body image. (C) 2016 Elsevier Ltd. All rights reserved."
1066,Psychology  , Eating disorders  , Students; Physical activity; Eating disorders; Substance use        ,"A number of previous studies have focused on the effect of sport practice on eating disorders and substance use. Most of these studies suggest that among students sport practice is related to low levels of health issues like eating disorders and substance use. However, there is a relative dearth of evidence for these relationships and previous findings are based on comparisons between people involved in sport practice and physical activity and sedentary or largely inactive people. The present study aims to test the effects of frequency of sport practice on college students' eating disorders and substance use when also controlling for gender effects. Methods. - One thousand and seventy-three first year college students (35.6% boys, 64.4% girls) volunteered to participate in the study. Participants were divided into three groups according to the frequency of their sport practice: students who rarely participated in sport practice (less than one hour a week and not every week; 406 students, 26.4% boys vs 73.6% girls), students who frequently participated in sport practice (every week but less than eight hours a week; 173 students, 33.5% boys vs 66.5% girls), and students who had intensive sport practice (eight hours a week or more; 494 students, 43.9% boys vs 56.1% girls). Alcohol, tobacco and cannabis use were assessed using the Alcohol Smoking and Substance Involvement Screening Test (ASSIST). Three different categories of eating disorders (Dieting, Bulimia, Oral control) were assessed using the EAT -26 inventory. ANOVAs were computed to test for gender differences across the three sport practice groups. Results. - Results of univariate ANOVAs revealed main effects for gender and sport practice on some of the substance use and eating disorder variables, ANOVA with multiple comparisons (Tamhan T Test) revealed a significant interaction effect of sport practice and gender on oral control and tobacco use. For girls, oral control and tobacco use do not vary within the three groups of sport practice whereas for boys the more frequent the sport practice, the lower their scores on oral control and tobacco use. For oral control, boys reported significantly higher scores than girls only when sport practice was rare. For tobacco use, boys reported significantly higher scores than girls when sport practice was rare and lower scores when sport practice was intensive. Conclusion. - These results suggest that the positive effects of sport practice vary by gender and that the campaigns for promotion of physical activity might assist in the prevention of health issues amongst students but should be adapted according to the gender of the participants. (C) 2014 Published by Elsevier Masson SAS on behalf of Societe francaise de psychologie."
1431,Psychology  , Eating disorders  , Eating disorders; Anorexia nervosa; Portion size; Anxiety; Food choice; Energy density        ,"A study in which adolescent patients with anorexia nervosa (n = 24) rated their expected food-anxiety in response to images of portions of food (potatoes, rice pizza, and M&Ms) showed that lower energy-dense foods elicited higher expected anxiety per kilocalorie than higher energy-dense foods. However, the area of the portion sizes could be an unmeasured variable driving the anxiety response. To test the hypothesis that area mediates the effects of energy content on expected anxiety, the same images of portions were measured in area (cm(2)), and standardized values of expected anxiety were regressed from standardized values of energy and area of portions. With regression of expected anxiety from portion size in area, M&Ms, which had the highest energy density of the four foods, elicited the highest expected anxiety slope beta = 1.75), which was significantly different from the expected anxiety slopes of the other three foods (beta range = 0.67 - 0.96). Area was confirmed as a mediator of energy effects from loss of significance of the slopes when area was added to the regression of expected anxiety from energy x food. When expected anxiety was regressed from food, area, energy and area by energy interaction, area accounted for 5.7 times more variance than energy, and beta for area (0.7) was significantly larger (by 0.52, SE = 0.15, t = 3.4, p = 0.0007) than beta for energy (0.19). Area could be a learned cue for the energy content of food portions, and thus, for weight gain potential, which triggers anxiety in patients with anorexia nervosa. Crown Copyright (C) 2017 Published by Elsevier Ltd. All rights reserved."
520,Psychology  , Depression  , aggression; hypomania/mania; major depression; bipolar spectrum; behavioral approach system        ,"A growing body of research suggests that bipolar spectrum disorders (BSDs) are associated with high aggression. However, little research has prospectively examined how aggression may affect time to onset of hypomanic/manic versus major depressive episodes. In a longitudinal study, we tested the hypothesis that aggression would prospectively predict a shorter time to the onset of hypomanic/manic episodes and a longer time to the onset of major depressive episodes, based on the behavioral approach system theory of BSDs. Young adults (N=120) diagnosed with cyclothymia, bipolar II disorder, or bipolar disorder not otherwise specified were followed every 4 months for an average of 3.55 years. Participants completed measures of depressive and manic symptoms, family history of mood disorder, impulsivity, and aggression at baseline and were followed prospectively with semistructured diagnostic interview assessments of hypomanic/manic and major depressive episodes and treatment seeking for mood problems. Cox proportional hazard regression analyses indicated that overall, physical, and verbal aggression predicted a longer time to major depressive episode onset, even after controlling for baseline depressive and manic symptoms, family history of mood disorder, treatment seeking for mood problems, and impulsivity. Aggression, however, did not significantly predict time to onset of hypomanic/manic episodes, controlling for the same covariates. The findings suggest that approach-related behaviors may be utilized to delay the onset of major depressive episodes among people with BSDs."
607,Psychology  , Depression  , Asthma; Depression; Sleep; Disorders of excessive somnolence        ,"A large number of asthmatic patients, particularly females, present inadequate disease control. Depressive symptoms are reportedly common in asthma and have been related to poor disease control, but the mechanism of this association is still unclear. Poor quality sleep, frequently observed in asthmatics, is also a manifestation of depression and has been related to uncontrolled asthma. This study aimed to investigate the relationship between depressive symptoms, sleep quality, and asthma control. This was a cross-sectional study of 123 women with previous diagnosis of asthma from a reference center in Fortaleza, Brazil. Depressive symptoms were assessed by the Beck Depression Inventory (BDI); quality of sleep was evaluated by the Pittsburgh Sleep Quality Index (PSQI), daytime sleepiness by the Epworth Sleepiness Scale (ESS), and asthma control by the Asthma Control Test (ACT). Inadequate asthma control (ACT5) in 99 (80.49 %), and excessive daytime sleepiness (ESS >= 10) in 34 (27.64 %). Depressive symptoms were associated with both poor quality sleep (R = 0.326) and inadequate asthma control (R = -0.299). Regression analysis showed that depressive symptoms and sleep quality were independent predictors of the level of asthma control. Asthma control in women is independently associated with depressive symptoms and quality of sleep, suggesting that these patients might benefit from simple measures to promote healthy sleep behavior and sleep hygiene and also that routine screening for depression can be relevant, particularly, in poorly controlled cases."
761,Medical , Depression  , Spreading depression; brain trauma; cerebral blood flow; electrophysiology; focal ischemia; brain edema; subarachnoid hemorrhage; vasospasm; two photon microscopy; system biology; stroke; selective neuronal death; neurovascular coupling; neuroprotection; neurocritical care; global ischemia; diffusion weighted MRI; cerebrovascular disease; cardiac arrest; brain ischemia        ,"A modern understanding of how cerebral cortical lesions develop after acute brain injury is based on Aristides Le (a) over tilde $o's historic discoveries of spreading depression and asphyxial/anoxic depolarization. Treated as separate entities for decades, we now appreciate that these events define a continuum of spreading mass depolarizations, a concept that is central to understanding their pathologic effects. Within minutes of acute severe ischemia, the onset of persistent depolarization triggers the breakdown of ion homeostasis and development of cytotoxic edema. These persistent changes are diagnosed as diffusion restriction in magnetic resonance imaging and define the ischemic core. In delayed lesion growth, transient spreading depolarizations arise spontaneously in the ischemic penumbra and induce further persistent depolarization and excitotoxic damage, progressively expanding the ischemic core. The causal role of these waves in lesion development has been proven by real-time monitoring of electrophysiology, blood flow, and cytotoxic edema. The spreading depolarization continuum further applies to other models of acute cortical lesions, suggesting that it is a universal principle of cortical lesion development. These pathophysiologic concepts establish a working hypothesis for translation to human disease, where complex patterns of depolarizations are observed in acute brain injury and appear to mediate and signal ongoing secondary damage."
900,Medical , Depression  , Cortical spreading depolarisation; subarachnoid haemorrhage; stroke; traumatic brain injury; migraine        ,"A new research field in translational neuroscience has opened as a result of the recognition since 2002 that ""spreading depression of Le (a) over tilde $o'' can be detected in many patients with acute brain injury, whether vascular and spontaneous, or traumatic in origin, as well as in those many individuals experiencing the visual (or sensorimotor) aura of migraine. In this review, we trace from their first description in rabbits through to their detection and study in migraine and the injured human brain, and from our personal perspectives, the evolution of understanding of the importance of spread of mass depolarisations in cerebral grey matter. Detection of spontaneous depolarisations occurring and spreading in the periphery or penumbra of experimental focal cortical ischemic lesions and of their adverse effects on the cerebral cortical microcirculation and on the tissue glucose and oxygen pools has led to clearer concepts of how ischaemic and traumatic lesions evolve in the injured human brain, and of how to seek to improve clinical management and outcome. Recognition of the likely fundamental significance of spreading depolarisations for this wide range of serious acute encephalopathies in humans provides a powerful case for a fresh examination of neuroprotection strategies."
901,Psychology  , Depression  , Thin walled metal spherical shell; Sandwich structure; Axial compression; Finite element; Yield rule        ,"A new sandwich structure which core is made of thin-walled semi-ellipsoidal shell is designed, column cell sandwich composite was prepared by pre-panel preparation process. A series of quasi-static axial compression experiments were carried out on 2 x 2 thin-walled semi-ellipsoidal shell, the compression deformation and yield behavior of thin wall semi-ellipsoidal shells with different materials, diameters and wall thicknesses were studied by means of ANSYS/LS-DYNA finite element simulation and experiment. Then, the effect of filling mode of epoxy resin on the mechanical properties of Column-cell sandwich composites was studied. The results show that the deformation process of the thin spherical shell can be divided into local flattening, axisymmetric depression, non-axisymmetric depression and compaction stage. As the wall thickness increases, the deformation""mode changes from the polygon to the ring and the deformation process become three stages; small diameter requires larger force under the conditions of the same compression displacement, as the diameter increases, the critical displacement of flipping and asymmetric buckling increases; Epoxy filled in the spherical shell of the sample specific compression performance is better than filled in the outer shell and better than unfilled with epoxy resin. (C) 2017 Elsevier B.V. All rights reserved."
204,Psychology  , Borderline personality disorder  , game theory; economic games; computational psychiatry; social decision-making; personality disorder        ,"A central aspect of many psychiatric disorders is the disturbance of decision-making in social interactions. This disturbance importantly contributes to the severe social consequences of these conditions. The combination of economic game theory and neuroscience opens up the potential to examine dysfunctional social behavior at the computational level, including psychological, social and biological information in the same model. In current studies, we examine social decision-making in patients with depression, bipolar disorder, borderline personality disorder and autism spectrum disorder using simple social experiments. We found that social decision-making is less consistent in patients with borderline personality disorder than in depressed individuals, patients with autism and controls. Adult patients with autism spectrum disorders showed reduced unconditional altruism in our experiments. Patients with major depressive disorder specifically exhibited competition avoidance. We currently examine the neural substrate of abnormal social decision-making using fMRI."
