,Domain,area,keywords,Abstract
1491,Medical , Hypothyroidism  , GC-MS metabolomic data validation and normalization; Mammalian brain metabolism; Adult-onset hypothyroidism (AOH); Balb/cJ mouse cerebellum; Metabolic network analysis; Systems biology        ,"A systematic data quality validation and normalization strategy is an important component of the omic profile meta-analysis, ensuring comparability of the profiles and exclusion of experimental biases from the derived biological conclusions. In this study, we present the normalization methodology applied on the sets of cerebellum gas chromatography-mass spectrometry metabolic profiles of 124 days old male and female animals in an adult-onset-hypothyroidism (AOH) mouse model before combining them into a sex-comparative analysis. The employed AOH model concerns the monitoring of the brain physiology of Balb/cJ mice after eight-week administration of 1%w/v KClO4 in the drinking water, initiated on the 60th day of their life. While originating from the same animal study, the tissues of the two sexes were processed and their profiles acquired and analyzed at different time periods. Hence, the previously published profile set of male mice was first re-annotated based on the presently available resources. Then, after being validated as acquired under the same analytical conditions, both profiles sets were corrected for derivatization biases and filtered for low-confidence measurements based on the same criteria. The final normalized 73-metabolite profiles contribute to the currently few available omic datasets of the AOH effect on brain molecular physiology, especially with respect to sex differentiation. Multivariate statistical analysis indicated one (unknown) and three (succinate, benzoate, myristate) metabolites with significantly higher and lower, respectively, cerebellum concentration in the hypothyroid compared to the euthyroid female mice. The respective numbers for the males were two and 24. Comparison of the euthyroid cerebellum metabolic profiles between the two sexes indicated 36 metabolites, including glucose, myo- and scyllo-inositol, with significantly lower concentration in the females versus the males. This implies that the female mouse cerebellum has been conditioned to smaller changes in its metabolic activity with respect to the pathways involving these metabolites compared to the male animals. In conclusion, our study indicated a much subtler AOH effect on the cerebellum metabolic activity of the female compared to the male mice. The leaner metabolic profile of the female mouse cerebellum was suggested as a potential factor contributing to this phenomenon. (C) 2016 Elsevier B.V. All rights reserved."
1667,Medical , Hypothyroidism  , Hypothyroidism; Myalgia; Rhabdomyolysis; Hoffmann's syndrome; Koche-Debre'-Semelaigne syndrome; Creatine kinase        ,"Abnormalities in thyroid function are common endocrine disorders that affect 5-10% of the general population, with hypothyroidism occurring more frequently than hyperthyroidism. Clinical symptoms and signs are often nonspecific, particularly in hypothyroidism. Muscular symptoms (stiffness, myalgias, cramps, easy fatigability) are mentioned by the majority of patients with frank hypothyroidism. Often underestimated is the fact that muscle symptoms may represent the predominant or the only clinical manifestation of hypothyroidism, raising the issue of a differential diagnosis with other causes of myopathy, which sometimes can be difficult. Elevated serum creatine kinase, which not necessarily correlates with the severity of the myopathic symptoms, is certainly suggestive of muscle impairment, though it does not explain the cause. Rare muscular manifestations, associated with hypothyroidism, are rhabdomyolysis, acute compartment syndrome, Hoffman's syndrome and Kocher-Debre-Semelaigne syndrome. Though the pathogenesis of hypothyroid myopathy is not entirely known, proposed mechanisms include altered glycogenolytic and oxidative metabolism, altered expression of contractile proteins, and neuro-mediated damage. Correlation studies of haplotype, muscle gene expression and protein characterization, could help understanding the pathophysiological mechanisms of this myopathic presentation of hypothyroidism."
1771,Medical , Hypothyroidism  , Sperm motility; DNA damage; L-Thyroxine; PI3K/Akt; p53        ,"Accumulating evidences showed that thyroid hormone was participated in the functioning of the reproductive system, and an elevated level of thyroid hormones had a negative impact on reproductive system. However, the molecular basis for this observation still remains to be fully understood. Here, we show that L-Thyroxine significantly impaired human sperm motility. The molecular basis showed that thyroxine receptor stimulation triggers Phosphatidyl Inositol 3-kinase (PI3K)/Akt signaling activation leading to the E3 ligase MDM2 phosphorylation at serine 166, which directly interacted with p53 for degradation. p53 degradation caused a p53-dependent DNA damage checkpoint or repair dysfunction, which eventually results in DNA damage accumulation in sperm. Our results highlight that inhibition of PI3K/Akt pathway or p53 degradation is important in maintaining sperm motility in a thyroxine receptor (TR)-dependent manner. (C) 2017 Elsevier B.V. All rights reserved."
212,Medical , Idiopathic Pulmonary Fibrosis  , caveolin 1 and caveolin 2 knockouts; double-siRNA; Bid; caspase-8; IAPs; lung fibrosis        ,"A characteristic feature of idiopathic pulmonary fibrosis (IPF) is accumulation of apoptotic resistant fibroblasts/myofibroblasts in the fibroblastic foci. As caveolin (Cav)-null mice develop pulmonary fibrosis (PF), we hypothesized that the participating fibroblasts display an apoptosis-resistant phenotype. To test this hypothesis and identify the molecular mechanisms involved we isolated lung fibroblasts from Cav-null mice and examined the expression of several inhibitors of apoptosis (IAPs), of c-FLIP, of Bcl-2 proteins and of the death receptor CD95/Fas. We found significant increase in XIAP and c-FLIP constitutive protein expression with no alteration of Bcl-2 and lower levels of CD95/Fas. The isolated fibroblasts were then treated with the CD95/Fas ligand (FasL) to induce apoptosis. While the morphological and biochemical alterations induced by FasL were similar in wild-type (wt) and Cav-null mouse lung fibroblasts, the time course and the extent of the alterations were greater in the Cav-null fibroblasts. Several salient features of Cav-null fibroblasts response such as loss of membrane potential, fragmentation of the mitochondrial continuum concurrent with caspase-8 activation, and subsequent Bid cleavage, prior to caspase-3 activation were detected. Furthermore, M30 antigen formation, phosphatidylserine expression and DNA fragmentation were caspase-3 dependent. SiRNA-mediated silencing of XIAP and c-FLIP, individually or combined, enhanced the sensitivity of lung fibroblasts to FasL-induced apoptosis. Pharmacological inhibition of Bcl-2 had no effect. Together our findings support a mechanism in which CD95/Fas engagement activates caspase-8, inducing mitochondrial apoptosis through Bid cleavage. XIAP and c-FLIP fine tune this process in a cell-type specific manner."
298,Medical , Idiopathic Pulmonary Fibrosis  , corona; silica nanoparticles; nano-bio interface; lung fibrosis; TGF-   beta 1       ,"A corona is a layer of macromolecules formed on a nanoparticle surface in vivo. It can substantially change the biological identity of nanomaterials and possibly trigger adverse responses from the body tissues. Dissecting the role of the corona in the development of a particular disease may provide profound insights for understanding toxicity of nanomaterials in general. In our present study, we explored the capability of different silica nanoparticles (SiNPs) to induce silicosis in the mouse lung and analyzed the composition of coronas formed on these particles. We found that SiNPs of certain size and surface chemistry could specifically recruit transforming growth factor beta 1 (TGF-beta 1)intotheircorona, which subsequently induces the development of lung fibrosis. Once embedded into the corona on SiNPs, TGF-beta l was remarkably more stable than in its free form, and its fibrosis-triggering activity was significantly prolonged. Our study meaningfully demonstrates that a specific corona component on a certain nanoparticle could initiate a particular pathogenic process in a clinically relevant disease model. Our findings may shed light on the understanding of molecular mechanisms of human health risks correlated with exposure to small-scale substances."
1639,Medical , Idiopathic Pulmonary Fibrosis  , Kallistatin; bleomycin; pulmonary fibrosis; angiogenesis        ,"Aberrant angiogenesis and vascular remodeling are the main features of idiopathic pulmonary fibrosis. Kallistatin is an anti-angiogenic peptide with known effects on endothelial cells. This study aimed to demonstrate that kallistatin has beneficial effects on bleomycin (BLM)-induced pulmonary fibrosis in a rat model by inhibiting angiogenesis. Twenty-five rats were randomly divided into five experimental groups: (A) Saline only (SA)-as the negative control, (B) BLM only (BLM)-as the model group, (C) BLM and 0.1 mg/kg kallistatin (L-Kal), (D) BLM and 0.5 mg/kg kallistatin (M-Kal), and (E) BLM and 2.5 mg/kg kallistatin (H-Kal). Fibrillar collagen was quantified by Masson's trichrome and hematoxylin-eosin staining. Transforming growth factor-beta 1 (TGF-beta 1), a-smooth-muscle-actin (alpha-SMA) and microvascular density (MVD) were measured by immunohistochemistry. Vascular endothelial growth factor (VEGF), vascular endothelial growth factor receptor (VEGFR), and tumor necrosis factor-alpha (TNF-alpha) were assayed by Western immunoblotting or ELISA. Daily administration of kallistatin attenuated fibrosis in BLM-induced pulmonary fibrosis, as shown by histology. During inflammation from BLM-induced pulmonary fibrosis, kallistatin reduced the number of inflammatory cells infiltrating the bronchoalveolar lavage fluid. Kallistatin also inhibited VEGF expression and phosphorylation of VEGFR2 (Flk-1). In vitro, kallistatin blocked tube formation by inhibiting Flk-1 and GSK-3 beta phosphorylation. The results demonstrated that continuous administration of kallistatin attenuated BLM-induced pulmonary fibrosis and improved survival of BLM rats. Reducing pulmonary fibrosis was achieved by partial inhibition of pulmonary inflammation and angiogenesis."
1904,Medical , Idiopathic Pulmonary Fibrosis  , Idiopathic pulmonary fibrosis; Acute exacerbation; Bacterial infection; 16S        ,"Acute exacerbations of idiopathic pulmonary fibrosis (AE-IPF) have been defined as events of clinically significant respiratory deterioration with an unidentifiable cause. They carry a significant mortality and morbidity and while their exact pathogenesis remains unclear, the possibility remains that hidden infection may play a role. The aim of this pilot study was to determine whether changes in the respiratory microbiota occur during an AE-IPF. Bacterial DNA was extracted from bronchoalveolar lavage from patients with stable IPF and those experiencing an AE-IPF. A hyper-variable region of the 16S ribosomal RNA gene (16S rRNA) was amplified, quantified and pyrosequenced. Culture independent techniques demonstrate AE-IPF is associated with an increased BAL bacterial burden compared to stable disease and highlight shifts in the composition of the respiratory microbiota during an AE-IPF."
1955,Medical , Idiopathic Pulmonary Fibrosis  , adenosine 5 '-triphosphate; fibrosis; inflammation; NLRP3-inflammasome; P2X7; purinergic receptors        ,"Adenosine triphosphate is involved in many metabolic reactions, but it has also a role as a cellular danger signal transmitted through purinergic receptors (PRs). Indeed, adenosine 5;-triphosphate (ATP) can bind to PRs which are found in the membrane of many cell types, although the relative proportions of the receptor subtypes differ. PRs are classified according to genetic and pharmacological criteria and especially their affinities for agonists and their transduction mechanism (i.e. as metabotropic P2YRs or ionotropic P2XRs). Extracellular ATP release by activated or necrotic cells may activate various PRs and especially P2X7R, the best-characterized PR, on immune cells. P2X7R is known to regulate the activation of the Nod-like receptor (NLR)-family protein, NLRP3 inflammasome, which permit the release of IL-1b, a potent pro-inflammatory cytokine. The P2X7R/NLRP3 pathway is involved in many inflammatory diseases, such as gout, and in fibrosis diseases associated with inflammatory process, liver or lung fibrosis. Some authors imaging also a real promising therapeutic potential of P2X7R blockage. Thus, several pharmaceutical companies have developed P2X7R antagonists as novel anti-inflammatory drug candidates. Clinical trials of the efficacy of these antagonists are now underway. A better understanding of the P2X7R/NLRP3 signalling pathways permits the identification of targets and the development of a new class of drugs able to inhibit the fibrogenesis process and collagen deposition."
143,Medical , Irritable Bowel Syndrome  , Cancer; clinical studies; clinical studies; clinical studies; gastrointestinal disorders; tumour markers        ,"A 52-year-old lady presented with a history of occasional, severe abdominal cramps, postprandial diarrhoea and weight loss. After routine gastrointestinal investigations, she was diagnosed with irritable bowel syndrome. Over six months, she developed occasional facial flushing prompting assessment of neuroendocrine tumour markers. Urinary 5HIAA, 5HT, chromogranin A and neurokinin A were significantly elevated. Scans showed extensive hepatic metastases but did not show the location of a primary tumour. Somatostatin analogue therapy was commenced but despite increasing doses, symptoms increased and biomarkers rose dramatically. Interferon alpha was introduced concomitant with somatostatin analogue therapy. Biomarkers were monitored regularly. Within six months, symptoms abated and biomarkers reduced, continuing to fall over the next year, close to reference range. To manage side-effects of interferon alpha, dose was reduced from time to time. During these short periods, neurokinin A showed significant transient increases (75-150ng/L) and carcinoid symptoms returned. For more than seven years, and with the co-operation of the patient, a balance was achieved between interferon alpha side-effects and disease control. Scans showed tumour load to be stable. The patient survived for 10 years post diagnosis. She chose to discontinue interferon alpha and received peptide receptor radiation therapy in her final year. Throughout, neurokinin A remained the most sensitive monitor of her disease progression."
355,Medical , Irritable Bowel Syndrome  , diet; FODMAPs; functional gastrointestinal disorder; irritable bowel syndrome; lactose        ,"A diet low in poorly absorbed, fermentable, short chain carbohydrates (FODMAPs) is an effective strategy to manage symptoms of irritable bowel syndrome (IBS). The diet has gained traction since its original description in Australia 10 years ago and is now an internationally accepted dietary management strategy for IBS. Randomized controlled trials have raised the profile of the low-FODMAP diet to become a viable first-line therapy for IBS, when implemented under a dietitian's guidance. Importantly, the diagnosis of IBS should be confirmed before commencement of the dietary approach. The skill set of the dietitian is then paramount to the success of the diet. Experience in gastrointestinal disorder management, consideration of symptom types, severity, baseline FODMAP intake, and overall nutritional content and meal pattern are vital in the assessment of the patient. If a strict low-FODMAP diet is deemed necessary, it should only be for an initial period of 4 to 6 weeks. Research suggests that a strict long-term, low-FODMAP diet may negatively impact intestinal microbiome. After the initial strict period, follow up with the dietitian should be conducted to achieve the overall goal-a relaxed FODMAP restriction that enables inclusion of prebiotic FODMAPs while still maintaining symptom relief. The diet will be effective in the vast majority of patients. For those in which it fails, FODMAPs should be reintroduced to the diet, and other dietary (or non-dietary) approaches should be considered."
377,Medical , Irritable Bowel Syndrome  , Celiac Disease; Wheat Allergy; Irritable Bowel Syndrome; Gluten-Free Diet        ,"A double-blind, placebo-controlled, gluten challenge has been proposed to confirm a diagnosis of nonceliac gluten sensitivity (NCGS) in patients without celiac disease who respond to a gluten-free diet. To determine the accuracy of this approach, we analyzed data from 10 double-blind, placebo-controlled, gluten-challenge trials, comprising 1312 adults. The studies varied in the duration of the challenge (range, 1 d to 6 wk), daily doses for the gluten challenge (range, 2-52 g; 3 studies administered <8 g/d), and composition of the placebo (gluten-free products, xylose, whey protein, rice, or corn starch containing fermentable carbohydrates). Most of the studies found gluten challenge to significantly increase symptom scores compared with placebo. However, only 38 of 231 NCGS patients (16%) showed gluten-specific symptoms. Furthermore, 40% of these subjects had a nocebo response (similar or increased symptoms in response to placebo). These findings reveal heterogeneity and potential methodology flaws among studies of gluten challenge, cast doubt on gluten as the culprit food component in most patients with presumptive NCGS, and highlight the importance of the nocebo effect in these types of studies."
492,Medical , Irritable Bowel Syndrome  , BDNF; Coeliac disease; DHA; Gluten-free diet; Ghrelin; Leptin; Psychological distress        ,"A gluten-free diet (GFD) has been reported to negatively impact the quality of life (QoL) of coeliac disease (CD) patients. The gut-brain axis hormones ghrelin and leptin, with the brain-derived neurotrophic factor (BDNF), may affect QoL of CD patients undergoing GFD. Our aims were to evaluate whether: (a) the circulating concentrations of leptin, ghrelin and BDNF in CD patients were different from those in healthy subjects; (b) GFD might induce changes in their levels; (c) BDNF Val66Met polymorphism variability might affect BDNF levels; and (d) serum BDNF levels were related to dietary docosahexaenoic acid (DHA) as a neurotrophin modulator. Nineteen adult coeliac patients and 21 healthy controls were included. A QoL questionnaire was administered, and serum concentrations of ghrelin, leptin, BDNF and red blood cell membrane DHA levels were determined at the enrolment and after 1 year of GFD. BDNF Val66Met polymorphism was analysed. Results from the questionnaire indicated a decline in QoL after GFD. Ghrelin and leptin levels were not significantly different between groups. BDNF levels were significantly (p = 0.0213) lower in patients after GFD (22.0 +/- 2.4 ng/ml) compared to controls (31.2 +/- 2.2 ng/ml) and patients at diagnosis (25.0 +/- 2.5 ng/ml). BDNF levels correlated with DHA levels (p = 0.008, r = 0.341) and the questionnaire total score (p = 0.041, r = 0.334). Ghrelin and leptin seem to not be associated with changes in QoL of patients undergoing dietetic treatment. In contrast, a link between BDNF reduction and the vulnerability of CD patients to psychological distress could be proposed, with DHA representing a possible intermediate."
612,Medical , Irritable Bowel Syndrome  , sex and gender; medication and device safety        ,"A large number of medications and medical devices removed from the market by the US Food and Drug Administration over the past 4 decades specifically posed greater health risks to women. This article reviews the historical background of sex and gender in clinical research policy and describes several approved drugs and devices targeted for use in women that have caused major morbidity and mortality. The intended population for the medications and devices, population affected, approval process, and the basic and legal actions taken against the medication/drug company are also discussed. It is recognized that women are still at risk for harm from unsafe medications and devices, and continued improvements in legislation that promotes inclusion of sex and gender into the design and analysis of research will improve safety for both men and women. (C) 2017 Elsevier HS Journals, Inc. All rights reserved."
1669,Medical , Kidney Health  , Kidney transplantation; Indigenous health; Health inequalities; Access to healthcare        ,Aboriginal Canadian patients with end-stage kidney disease receive disproportionately fewer transplants than non-Aboriginal patients. The reasons for this are poorly understood and likely to be complex. This qualitative study employed thematic analysis of in-depth interviews with Canadian kidney health professionals (n = 23) from programs across Canada to explore their perspective on this disparity. Individual-level factors were the most commonly reported barriers to Aboriginal patients accessing transplants-most notable of which was patients' remote living location. Understanding the role of 'place' as a barrier to accessing care and the lived experiences of Aboriginal patients emerged as key research priorities. (C) 2008 Elsevier Ltd. All rights reserved.
1908,Medical , Kidney Health  , Acute kidney injury; chronic kidney injury; matrix metalloproteinase-8; renal failure        ,"Acute kidney injury (AKI) leads to chronic kidney disease. The mechanisms involved with recovery from AKI are poorly understood and molecular mediators responsible for healing and restoration of kidney function are understudied. We previously discovered differential expression of matrix metalloproteinase-8 (MMP-8) mRNA and protein in patients with severe sepsis associated AKI versus sepsis without AKI. Here, we demonstrate the involvement of MMP-8 in purely ischemic AKI. Mice subjected to 30 min of bilateral renal ischemia developed increased plasma creatinine and MMP-8 expression within 24 h versus sham controls. After an initial surge and subsequent return toward baseline, both kidney MMP-8 expression and activity exhibited a late increase (Days 5-7 post-ischemia reperfusion) in mice subjected to AKI. Neutrophil infiltration of the kidney was significantly higher after AKI in wild-type mice than in MMP-8 null mice, starting at 4 days. Additionally, MMP-8 null mice subjected to AKI demonstrated a persistent histopathologic and functional injury and worsened health (greater overall weight loss) versus wild-type cohorts after seven days. Taken together, our findings suggest that MMP-8 is involved with restoration of baseline kidney health after ischemic kidney injury and that a potential mechanism involves the interaction of MMP-8 and neutrophil recruitment to the site of injury."
2750,Medical , Kidney Health  , CKD-EPI equation; Cockcroft-Gault equation; eGFR; kidney function; kidney function estimating equations; MDRD equation        ,"AimThe aim of this study is to determine the concordance among the Cockcroft-Gault, the Modification of Diet in Renal Disease and the Chronic Kidney Disease Epidemiology Collaboration (CKD-EPI) equations in hypothetical dosing of renally cleared medications. MethodsA total of 2163 patients prescribed at least one of the 31 renally cleared drugs under review were included in the study. Kidney function was estimated using the three equations. We compared actual prescribed dosages of the same drug with recommended dosages based on the kidney function as calculated by each of the equations and applying dosing recommendations in the Australian Medicines Handbook. ResultsThere was a significant difference in the kidney function values estimated from the three equations (P<0.001). Despite the good overall agreement in renal drug dosing, we found selected but potentially important discrepancies among the doses rendered from the equations. The CKD-EPI equation non-normalized for body surface area had a greater rate of concordance with the Cockcroft-Gault equation than the Modification of Diet in Renal Disease equation for renal drug dosing. ConclusionsThere is need for a long-term multi-centre study in a diverse population to define the clinical effects of the discrepancies among the equations for drug dosing. Given the greater concordance of the non-normalized CKD-EPI equation with the Cockcroft-Gault equation for dosing, the recommendation by Kidney Health Australia and the United States National Kidney Disease Education Program that dosing based on either eCrCl or an eGFR with body surface area normalization removed are acceptable' seems suitable and practicable for the purpose of dosing of non-critical drugs in the primary care setting."
